{
  "volume": "Vol.8",
  "phase": "Vol.8 Phase 8.6 - Vol.8 Handoff Summary and Vol.9 Readiness Gate",
  "baseline_commit": "4836b20c373b40aa92a822ee09bb718fc953ae2d",
  "runtime_records": 113,
  "frameworks_indexed": 24,
  "customer_facing_frameworks": 0,
  "live_runtime_execution_frameworks": 0,
  "fixture_static_read_only_frameworks": 24,
  "validation_backed_frameworks": 24,
  "static_shell_path": "static_shell/ldd/",
  "static_shell_status": "local_static_read_only_fixture_only",
  "vol8_status": "completed",
  "completed_phase_count": 6,
  "completed_phases": [
    "Vol.8 Phase 8.1 - Static Shell QA Handoff Intake and Boundary Freeze",
    "Vol.8 Phase 8.2 - Implemented Function Framework Index Output Module",
    "Vol.8 Phase 8.3 - Local Operator Feedback Review Model",
    "Vol.8 Phase 8.4 - Feedback-to-Roadmap Product Boundary Mapping",
    "Vol.8 Phase 8.5 - Future Implementation Readiness Ladder",
    "Vol.8 Phase 8.6 - Vol.8 Handoff Summary and Vol.9 Readiness Gate"
  ],
  "customer_facing_readiness": false,
  "network_allowed": false,
  "execution_allowed": false,
  "forbidden_scope_confirmed_absent": [
    "production UI",
    "customer-facing UI",
    "hosted app",
    "API server",
    "live endpoint",
    "external API",
    "broker connection",
    "Binance connection",
    "live market data",
    "trading automation",
    "credential handling",
    "login/auth",
    "runtime mutation",
    "execution trigger",
    "order placement",
    "portfolio modification",
    "background worker",
    "scheduler",
    "notification dispatcher",
    "GitHub Issues",
    "GitHub Projects board",
    "package manager files",
    "build tools",
    "frontend framework",
    "network dependency"
  ],
  "handoff_status": "ready",
  "handoff_notes": [
    "Vol.8 is completed as a static QA handoff and product-boundary mapping volume.",
    "Vol.9 entry is ready_with_limits for future planning and readiness-gate design only.",
    "No live/runtime/execution, network/API, credential/auth, broker/Binance, hosted, production, or customer-facing capability is introduced."
  ]
}
